{
  "version": 1,
  "epoch": 1,
  "logId": "qpk-demo",
  "approvalQuorum": 3,
  "finalityQuorum": 4,
  "maxByzantine": 1,
  "members": [
    {
      "id": "ca-1",
      "key": "l5M86lDbcNHr2MUQyb0TkSDKcWeXoe_4DaYWvfCuxsY",
      "root": "MIIBEDCBw6ADAgECAgEBMAUGAytlcDAPMQ0wCwYDVQQDEwRjYS0xMCAXDTcwMDEwMTAwMDAwMFoYDzIxMDAwMTAxMDAwMDAwWjAPMQ0wCwYDVQQDEwRjYS0xMCowBQYDK2VwAyEAl5M86lDbcNHr2MUQyb0TkSDKcWeXoe_4DaYWvfCuxsajQjBAMA4GA1UdDwEB_wQEAwIChDAPBgNVHRMBAf8EBTADAQH_MB0GA1UdDgQWBBSkTKfbcWVE4Q2-6D9KIgYVjbCaojAFBgMrZXADQQDIjntSMl-HWJXOaJoVungZON9muvD4ENy7_kehdaFF--VHKSylwXSNhm2usW8Wsh5CTnivNeBSlKgpWJTVDt8N",
      "url": ""
    },
    {
      "id": "ca-2",
      "key": "pnDvFkBToYbH9kpQtTM-8AmNG8VP_V8Tno4GQmnbYqk",
      "root": "MIIBEDCBw6ADAgECAgEBMAUGAytlcDAPMQ0wCwYDVQQDEwRjYS0yMCAXDTcwMDEwMTAwMDAwMFoYDzIxMDAwMTAxMDAwMDAwWjAPMQ0wCwYDVQQDEwRjYS0yMCowBQYDK2VwAyEApnDvFkBToYbH9kpQtTM-8AmNG8VP_V8Tno4GQmnbYqmjQjBAMA4GA1UdDwEB_wQEAwIChDAPBgNVHRMBAf8EBTADAQH_MB0GA1UdDgQWBBRmjUcy9Q-YIr3xgaXzOlHfDGs0AjAFBgMrZXADQQDgXCYuyATJ2S9yGvhIPPBjB6U0sSKpfVcZVyXIOB4WHc15Ju-wLKfzhO76OvMPCMRuu3I583fB_KmYhG2WsCYF",
      "url": ""
    },
    {
      "id": "ca-3",
      "key": "0lt2tuPtMnIyAyxQkTReO4okV_MXMpDH0UPfSo0KiR0",
      "root": "MIIBEDCBw6ADAgECAgEBMAUGAytlcDAPMQ0wCwYDVQQDEwRjYS0zMCAXDTcwMDEwMTAwMDAwMFoYDzIxMDAwMTAxMDAwMDAwWjAPMQ0wCwYDVQQDEwRjYS0zMCowBQYDK2VwAyEA0lt2tuPtMnIyAyxQkTReO4okV_MXMpDH0UPfSo0KiR2jQjBAMA4GA1UdDwEB_wQEAwIChDAPBgNVHRMBAf8EBTADAQH_MB0GA1UdDgQWBBQ-PiGi6Qx1q3n_MWSAochm2hgd3zAFBgMrZXADQQBecoQPuiscZQyasKh6sjYTXQCt3Yx388ccq_JAMHerJn4nhKfGraElAhP6zk6ao3qQOjC7yuhl-tVZY75DPdQL",
      "url": ""
    },
    {
      "id": "ca-4",
      "key": "zwIfsST_oIAB_d1niyTJzfuQ6cMECY7a6jeerVwFhro",
      "root": "MIIBEDCBw6ADAgECAgEBMAUGAytlcDAPMQ0wCwYDVQQDEwRjYS00MCAXDTcwMDEwMTAwMDAwMFoYDzIxMDAwMTAxMDAwMDAwWjAPMQ0wCwYDVQQDEwRjYS00MCowBQYDK2VwAyEAzwIfsST_oIAB_d1niyTJzfuQ6cMECY7a6jeerVwFhrqjQjBAMA4GA1UdDwEB_wQEAwIChDAPBgNVHRMBAf8EBTADAQH_MB0GA1UdDgQWBBRQEbzR7hw-TymmQviZQtxx9S-rcDAFBgMrZXADQQAc31gWIWI0LeC3h-7Mvr6EJA8cqnupZ0boSkU5N0KlJN636_c2bHVC9rDJPnrN8RDgSIEH_1uH3m_BTqkG0bwG",
      "url": ""
    },
    {
      "id": "ca-5",
      "key": "vOFBQbHbViSRHiRJ7283sGkVZ4uqp0q-6LJJdzuBQUE",
      "root": "MIIBEDCBw6ADAgECAgEBMAUGAytlcDAPMQ0wCwYDVQQDEwRjYS01MCAXDTcwMDEwMTAwMDAwMFoYDzIxMDAwMTAxMDAwMDAwWjAPMQ0wCwYDVQQDEwRjYS01MCowBQYDK2VwAyEAvOFBQbHbViSRHiRJ7283sGkVZ4uqp0q-6LJJdzuBQUGjQjBAMA4GA1UdDwEB_wQEAwIChDAPBgNVHRMBAf8EBTADAQH_MB0GA1UdDgQWBBQg3AENViyMSG5q5s30NFECHBU_KDAFBgMrZXADQQCnm8PloDVKFlI68tAKj6xU-jaury3w19LxNfLrj77XmKDjc7_Q2EsClXaop4BskqeteN9d9ui-KKDaOH0tNqEB",
      "url": ""
    }
  ]
}